{
  "$schema": "https://json-schema.org/draft/2020-12/schema",
  "$id": "https://crewship.io/schemas/ask-form.v1.json",
  "title": "Crewship ask forms",
  "description": "The value of agents.ask_forms: the questionnaires one agent offers in the chat composer. Written with `crewship agent update <agent> --ask-forms @forms.json` or in the console under an agent's Config -> Ask forms.\n\nAUTHORING AID, NOT THE ENFORCEMENT. internal/askforms is the single write path and the only validator the server runs; this file exists so an editor can complete and check a forms.json before it is sent. Two validators that can disagree is a worse failure than no schema, so the caps and patterns here are pinned to the Go constants by TestSchemaMatchesConstants in internal/askforms - if you change one, that test makes you change the other. Two rules cannot be expressed in JSON Schema at all and live only in Go: every {{placeholder}} must name a field on its own form, and form ids must be unique.",
  "type": "array",
  "maxItems": 4,
  "items": {
    "type": "object",
    "required": [
      "id",
      "label",
      "template",
      "fields"
    ],
    "additionalProperties": false,
    "properties": {
      "id": {
        "type": "string",
        "pattern": "^[a-z0-9][a-z0-9_-]*$",
        "maxLength": 48,
        "description": "Stable handle. `crewship agent ask-preview <agent> <id>` renders this form."
      },
      "label": {
        "type": "string",
        "minLength": 1,
        "maxLength": 48,
        "description": "The chip's text."
      },
      "label_cs": {
        "type": "string",
        "maxLength": 48
      },
      "icon": {
        "type": "string"
      },
      "version": {
        "type": "integer",
        "minimum": 1,
        "description": "The author's revision number for this questionnaire. Carried into every submission's metadata envelope, so a transcript written last month can still be read against the form that produced it - the definition moves, the answers do not. Optional; absent means 1."
      },
      "template": {
        "type": "string",
        "minLength": 1,
        "maxLength": 2000,
        "description": "The message that gets sent. {{field}} substitution only - no conditionals, no loops, no expressions. Every placeholder must name a field on this form, or the save is refused. An empty optional value drops the whole line it sits on, static label and all, unless another placeholder on that line produced something."
      },
      "attachment": {
        "enum": [
          "none",
          "optional",
          "required"
        ],
        "default": "none"
      },
      "fields": {
        "type": "array",
        "minItems": 1,
        "maxItems": 6,
        "items": {
          "type": "object",
          "required": [
            "name",
            "label",
            "type"
          ],
          "additionalProperties": false,
          "properties": {
            "name": {
              "type": "string",
              "pattern": "^[a-z][a-z0-9_]*$",
              "maxLength": 48,
              "description": "The placeholder token. {{name}} in the template renders this field's answer. A money field also answers to {{name_currency}}."
            },
            "label": {
              "type": "string",
              "minLength": 1,
              "maxLength": 48
            },
            "label_cs": {
              "type": "string",
              "maxLength": 48
            },
            "type": {
              "type": "string",
              "minLength": 1,
              "maxLength": 32,
              "pattern": "^[a-z][a-z0-9_-]*$",
              "not": {
                "pattern": "(secret|password|passwd|passphrase|credential|token|oauth|cvv|api[_-]?key|private[_-]?key|(^|[_-])(key|pin|otp|totp|ssn|pwd|auth)([_-]|$))"
              },
              "description": "text, textarea, number, money, date, month, select, multiselect, checkbox, file or photo. NOT an enum on purpose: an unrecognised type falls back to a text input, which is what lets the server ship a new field type without a coordinated frontend release. The list is open, but not unconditionally: a type whose NAME says the value is a secret (password, api_key, client_secret, otp...) is refused, because a form submit is an ordinary chat message that is stored, searchable and read by the agent — there is no field type that makes that safe. Put the credential in the vault and reference it by name. The `not` pattern here mirrors the rule in internal/askforms/fieldtypes.go, and internal/askforms/schema_test.go checks the two against the same fixture every type case is listed in.",
              "examples": [
                "text",
                "textarea",
                "number",
                "money",
                "date",
                "month",
                "select",
                "multiselect",
                "checkbox",
                "file",
                "photo"
              ]
            },
            "required": {
              "type": "boolean"
            },
            "placeholder": {
              "type": "string"
            },
            "help": {
              "type": "string"
            },
            "default": true,
            "options": {
              "type": "array",
              "items": {
                "type": "string",
                "minLength": 1
              },
              "minItems": 1,
              "description": "Required for select and multiselect."
            },
            "currency": {
              "type": "array",
              "items": {
                "type": "string",
                "minLength": 1
              },
              "description": "Offered next to a money amount; the chosen one renders as {{<name>_currency}}."
            },
            "multiple": {
              "type": "boolean",
              "description": "Only on file and photo, where false caps the field at one upload. A multiselect is already multi-valued and everything else is one answer, so multiple on any other type is refused - a constraint the submit path would not enforce must not be storable."
            },
            "min": {
              "type": "number",
              "description": "What min MEANS depends on the field: the VALUE for number and money, the LENGTH in characters for text, textarea and any unrecognised type, and the COUNT of answers for multiselect, file and photo. There is nothing sensible for date, month, select or checkbox, so a bound on one of those is refused rather than stored and ignored. Checked at submit in the chat and by `crewship agent ask-preview`."
            },
            "max": {
              "type": "number",
              "description": "The other end of min, with the same meaning per field type. min above max is refused: no answer could satisfy it."
            },
            "pattern": {
              "type": "string",
              "maxLength": 200,
              "description": "A regular expression the whole value must match - anchored at both ends, so CZ[0-9]{8} does not accept xxCZ25788001xx. Only on the text-ish types (text, textarea, and unrecognised types, which render as text inputs). Checked by Go on save and by the server on submission, using the same answer validator as CLI preview. Author patterns are never executed by the browser: Go-valid does not imply safe for a native backtracking engine. A legacy stored pattern Go cannot compile is not enforced; new invalid patterns cannot be saved."
            }
          }
        }
      }
    }
  }
}
