[
  {
    "id": "check-form",
    "label": "Investigate a missing inquiry",
    "template": "Investigate this demo form delivery.\nRecord: {{record}}\nExpected destination: {{destination}}\nObserved problem: {{problem}}\nUse the local marketing fixture. Explain the evidence and propose the smallest repair; do not contact external systems.\nOptional screenshot: {{screenshot}}",
    "attachment": "optional",
    "fields": [
      {
        "name": "record",
        "label": "Submission ID",
        "type": "text",
        "required": true,
        "default": "FORM-103"
      },
      {
        "name": "destination",
        "label": "Expected destination",
        "type": "text",
        "required": true,
        "default": "Demo sales inbox"
      },
      {
        "name": "problem",
        "label": "What happened?",
        "type": "textarea",
        "required": true,
        "default": "The form was accepted but the inquiry never arrived."
      },
      {
        "name": "screenshot",
        "label": "Screenshot",
        "type": "photo",
        "max": 1
      }
    ]
  }
]
